{
  "schemaVersion": "0.1",
  "kind": "Runtime",
  "id": "urn:agentos:runtime:example",
  "revision": 2,
  "createdAt": "2026-09-14T00:01:00Z",
  "authority": "agentos",
  "ownerRef": {"kind": "Owner", "id": "urn:agentos:owner:example", "schemaVersion": "0.1", "revision": 2},
  "provenance": {"producer": "agentos", "evidenceClass": "deterministicFixture", "sourceRefs": []},
  "releaseVersion": "1.0.0",
  "releaseDigest": {"algorithm": "sha256", "value": "bbbbbbbbbbbbbbbbbbbbbbbbbbbbbbbbbbbbbbbbbbbbbbbbbbbbbbbbbbbbbbbb", "scope": "runtimeDistribution"},
  "packageRef": {"kind": "AgentPackage", "id": "urn:agentos:agent-package:example", "schemaVersion": "0.1", "revision": 1, "releaseVersion": "1.0.0", "digest": {"algorithm": "sha256", "value": "aaaaaaaaaaaaaaaaaaaaaaaaaaaaaaaaaaaaaaaaaaaaaaaaaaaaaaaaaaaaaaaa", "scope": "packageArchive"}},
  "capabilityRefs": [{"kind": "Capability", "id": "urn:agentos:capability:example", "schemaVersion": "0.1", "revision": 1}],
  "adapterType": "localModel",
  "agentosApi": {"supportedVersions": ["0.1"], "unknownVersion": "reject"},
  "state": "connected",
  "health": "passed",
  "sandbox": {"profile": "agentosScoped", "hostHomeAccess": false, "arbitraryShell": false, "hostMounts": false, "dockerSocket": false, "network": "deny", "nestedAuthority": "subsetOfParentWork"},
  "executionAuthority": "workScopedGrantsOnly",
  "grantAuthority": "none",
  "canonicalMemoryWrite": false,
  "sealedEvidenceMutation": false,
  "finalCompletionAuthority": "agentos"
}
